{
  "$schema": "https://json-schema.org/draft/2020-12/schema",
  "title": "RoomContractCaseStudyInstance",
  "type": "object",
  "additionalProperties": false,
  "required": [
    "schema",
    "metamodelVersion",
    "caseId",
    "requirementsModel",
    "actors",
    "entities",
    "agents",
    "events",
    "conditions",
    "stateAssertions",
    "capabilityUses",
    "capabilities",
    "runtimeBindings",
    "validationCases",
    "satisfyRelationships"
  ],
  "properties": {
    "schema": {
      "type": "string"
    },
    "metamodelVersion": {
      "type": "string"
    },
    "caseId": {
      "type": "string"
    },
    "requirementsModel": {
      "type": "object"
    },
    "actors": {
      "type": "array"
    },
    "entities": {
      "type": "array"
    },
    "agents": {
      "type": "array"
    },
    "events": {
      "type": "array"
    },
    "conditions": {
      "type": "array"
    },
    "stateAssertions": {
      "type": "array"
    },
    "capabilityUses": {
      "type": "array"
    },
    "capabilities": {
      "type": "array"
    },
    "runtimeBindings": {
      "type": "array"
    },
    "validationCases": {
      "type": "array"
    },
    "satisfyRelationships": {
      "type": "array"
    }
  }
}
