{
  "schema": "roomcontract_case_study",
  "metamodelVersion": "v0.5",
  "caseId": "scene_007_transport_center_mini_r0",
  "requirementsModel": {
    "id": "RM-SCENE_007_TRANSPORT_CENTER_MINI_R0",
    "requirements": [
      {
        "id": "REQ-SCENE_007_TRANSPORT_CENTER_MINI_R0-001",
        "text": "The pipeline shall ingest an RDL scene and preserve stable object identities."
      },
      {
        "id": "REQ-SCENE_007_TRANSPORT_CENTER_MINI_R0-002",
        "text": "The pipeline shall derive room semantics grounded in existing RDL objects."
      },
      {
        "id": "REQ-SCENE_007_TRANSPORT_CENTER_MINI_R0-003",
        "text": "The pipeline shall synthesize backend-compatible spatial agent roles."
      },
      {
        "id": "REQ-SCENE_007_TRANSPORT_CENTER_MINI_R0-004",
        "text": "Every generated agent knowledge tag shall be covered by materialized knowledge."
      },
      {
        "id": "REQ-SCENE_007_TRANSPORT_CENTER_MINI_R0-005",
        "text": "Every generated agent shall be placed inside the room without obstacle overlap."
      },
      {
        "id": "REQ-SCENE_007_TRANSPORT_CENTER_MINI_R0-006",
        "text": "The generated behavior shall be traceable from requirements to runtime actions and validation cases."
      }
    ],
    "useCases": [
      {
        "id": "UC-SCENE_007_TRANSPORT_CENTER_MINI_R0-01",
        "name": "Generate spatially grounded multi-agent guide",
        "actor_ids": [
          "ACT-CASE-STUDY-ENGINEER",
          "ACT-ROOM-GUIDE"
        ],
        "extensionPoints": [],
        "includes": [],
        "extends": [],
        "scenarios": [
          {
            "id": "SC-SCENE_007_TRANSPORT_CENTER_MINI_R0-MAIN",
            "kind": "main",
            "description": "Authoring pipeline for generating and validating a spatially grounded multi-agent room guide.",
            "precondition_ids": [
              "COND-SCENE_007_TRANSPORT_CENTER_MINI_R0-VALID-INPUT"
            ],
            "postcondition_ids": [
              "SA-SCENE_007_TRANSPORT_CENTER_MINI_R0-SETUP-VALID"
            ],
            "steps": [
              {
                "id": "STEP-SCENE_007_TRANSPORT_CENTER_MINI_R0-S01",
                "stepNumber": 1,
                "kind": "actorIntent",
                "performedBy": "ACT-CASE-STUDY-ENGINEER",
                "text": "Provide an RDL file as case-study input.",
                "occurrenceProbability": 1.0,
                "triggeredBy": [
                  "EV-SCENE_007_TRANSPORT_CENTER_MINI_R0-RDL-PROVIDED"
                ],
                "guard": "COND-SCENE_007_TRANSPORT_CENTER_MINI_R0-VALID-INPUT",
                "resultingState": [],
                "capabilityUseIds": []
              },
              {
                "id": "STEP-SCENE_007_TRANSPORT_CENTER_MINI_R0-S02",
                "stepNumber": 2,
                "kind": "systemResponse",
                "performedBy": null,
                "text": "Load and normalize the RDL scene.",
                "occurrenceProbability": 1.0,
                "triggeredBy": [],
                "guard": null,
                "resultingState": [
                  "SA-SCENE_007_TRANSPORT_CENTER_MINI_R0-NORMALIZED-SCENE-VALID"
                ],
                "capabilityUseIds": [
                  "CU-SCENE_007_TRANSPORT_CENTER_MINI_R0-S02-ANALYZE-RDL-SCENE"
                ]
              },
              {
                "id": "STEP-SCENE_007_TRANSPORT_CENTER_MINI_R0-S03",
                "stepNumber": 3,
                "kind": "systemResponse",
                "performedBy": null,
                "text": "Derive semantic zones, visitor goals and interaction topics.",
                "occurrenceProbability": 1.0,
                "triggeredBy": [],
                "guard": null,
                "resultingState": [
                  "SA-SCENE_007_TRANSPORT_CENTER_MINI_R0-SCENE-SEMANTICS-VALID"
                ],
                "capabilityUseIds": [
                  "CU-SCENE_007_TRANSPORT_CENTER_MINI_R0-S03-ANALYZE-RDL-SCENE"
                ]
              },
              {
                "id": "STEP-SCENE_007_TRANSPORT_CENTER_MINI_R0-S04",
                "stepNumber": 4,
                "kind": "systemResponse",
                "performedBy": null,
                "text": "Generate spatially grounded agent roles and handoff rules.",
                "occurrenceProbability": 1.0,
                "triggeredBy": [],
                "guard": null,
                "resultingState": [
                  "SA-SCENE_007_TRANSPORT_CENTER_MINI_R0-AGENT-ROLES-VALID"
                ],
                "capabilityUseIds": [
                  "CU-SCENE_007_TRANSPORT_CENTER_MINI_R0-S04-DERIVE-SPATIAL-AGENT-ROLES"
                ]
              },
              {
                "id": "STEP-SCENE_007_TRANSPORT_CENTER_MINI_R0-S05",
                "stepNumber": 5,
                "kind": "systemResponse",
                "performedBy": null,
                "text": "Generate materialized knowledge entries for all agent knowledge tags.",
                "occurrenceProbability": 1.0,
                "triggeredBy": [],
                "guard": null,
                "resultingState": [
                  "SA-SCENE_007_TRANSPORT_CENTER_MINI_R0-KNOWLEDGE-VALID"
                ],
                "capabilityUseIds": [
                  "CU-SCENE_007_TRANSPORT_CENTER_MINI_R0-S05-GENERATE-ROOM-KNOWLEDGE"
                ]
              },
              {
                "id": "STEP-SCENE_007_TRANSPORT_CENTER_MINI_R0-S06",
                "stepNumber": 6,
                "kind": "systemResponse",
                "performedBy": null,
                "text": "Place generated agents inside the room near their responsibilities.",
                "occurrenceProbability": 1.0,
                "triggeredBy": [],
                "guard": null,
                "resultingState": [
                  "SA-SCENE_007_TRANSPORT_CENTER_MINI_R0-PLACEMENT-VALID"
                ],
                "capabilityUseIds": [
                  "CU-SCENE_007_TRANSPORT_CENTER_MINI_R0-S06-PLACE-AGENTS-IN-SCENE"
                ]
              },
              {
                "id": "STEP-SCENE_007_TRANSPORT_CENTER_MINI_R0-S07",
                "stepNumber": 7,
                "kind": "systemResponse",
                "performedBy": null,
                "text": "Assemble and validate the RoomContract trace instance.",
                "occurrenceProbability": 1.0,
                "triggeredBy": [],
                "guard": null,
                "resultingState": [
                  "SA-SCENE_007_TRANSPORT_CENTER_MINI_R0-ROOMCONTRACT-VALID"
                ],
                "capabilityUseIds": [
                  "CU-SCENE_007_TRANSPORT_CENTER_MINI_R0-S07-ASSEMBLE-FUNCTIONAL-RDL"
                ]
              },
              {
                "id": "STEP-SCENE_007_TRANSPORT_CENTER_MINI_R0-S08",
                "stepNumber": 8,
                "kind": "systemResponse",
                "performedBy": null,
                "text": "Materialize the Interactive Agents project files.",
                "occurrenceProbability": 1.0,
                "triggeredBy": [],
                "guard": null,
                "resultingState": [
                  "SA-SCENE_007_TRANSPORT_CENTER_MINI_R0-PROJECT-MATERIALIZED"
                ],
                "capabilityUseIds": [
                  "CU-SCENE_007_TRANSPORT_CENTER_MINI_R0-S08-MATERIALIZE-INTERACTIVE-AGENTS-PROJECT"
                ]
              },
              {
                "id": "STEP-SCENE_007_TRANSPORT_CENTER_MINI_R0-S09",
                "stepNumber": 9,
                "kind": "systemResponse",
                "performedBy": null,
                "text": "Set up an Interactive Agents runtime session.",
                "occurrenceProbability": 1.0,
                "triggeredBy": [],
                "guard": "COND-SCENE_007_TRANSPORT_CENTER_MINI_R0-AGENTS-AVAILABLE",
                "resultingState": [
                  "SA-SCENE_007_TRANSPORT_CENTER_MINI_R0-SETUP-VALID"
                ],
                "capabilityUseIds": [
                  "CU-SCENE_007_TRANSPORT_CENTER_MINI_R0-S09-SETUP-INTERACTIVE-SESSION"
                ]
              },
              {
                "id": "STEP-SCENE_007_TRANSPORT_CENTER_MINI_R0-S10",
                "stepNumber": 10,
                "kind": "actorIntent",
                "performedBy": "ACT-VISITOR",
                "text": "Ask a general room-related question to an agent.",
                "occurrenceProbability": 1.0,
                "triggeredBy": [
                  "EV-SCENE_007_TRANSPORT_CENTER_MINI_R0-VISITOR-QUESTION"
                ],
                "guard": null,
                "resultingState": [],
                "capabilityUseIds": []
              },
              {
                "id": "STEP-SCENE_007_TRANSPORT_CENTER_MINI_R0-S11",
                "stepNumber": 11,
                "kind": "systemResponse",
                "performedBy": null,
                "text": "Answer a general visitor question without a selected scene object.",
                "occurrenceProbability": 1.0,
                "triggeredBy": [],
                "guard": null,
                "resultingState": [
                  "SA-SCENE_007_TRANSPORT_CENTER_MINI_R0-ANSWER-GROUNDED"
                ],
                "capabilityUseIds": [
                  "CU-SCENE_007_TRANSPORT_CENTER_MINI_R0-ROUTE_GUIDE-S11-ANSWER-ROOM-GROUNDED-QUESTION",
                  "CU-SCENE_007_TRANSPORT_CENTER_MINI_R0-TECHNICAL_EXPLAINER-S11-ANSWER-ROOM-GROUNDED-QUESTION",
                  "CU-SCENE_007_TRANSPORT_CENTER_MINI_R0-MODEL_SPECIALIST-S11-ANSWER-ROOM-GROUNDED-QUESTION"
                ]
              },
              {
                "id": "STEP-SCENE_007_TRANSPORT_CENTER_MINI_R0-S12",
                "stepNumber": 12,
                "kind": "systemResponse",
                "performedBy": null,